{
  "$schema": "http://json-schema.org/draft-07/schema#",
  "type": "object",
  "properties": {
    "candidate_id": {
      "type": "string"
    },
    "role": {
      "type": "string"
    },
    "resume": {
      "type": "array",
      "items": {
        "type": "string"
      }
    },
    "requirements": {
      "type": "string"
    },
    "internal_notes": {
      "type": "string"
    }
  },
  "required": [
    "candidate_id",
    "role",
    "resume",
    "requirements"
  ]
}